#***************************************************************************

#sjplacer

#Version:            1.1

#Build Date:         Apr 25 2016 12:55:34

#File Generated:     Sep 17 2016 22:47:18

#Purpose:            

#Copyright (C) 2010-2011 by Softjin Technologies Pvt Ltd. All rights reserved.

#***************************************************************************

Executing : C:\Program Files (x86)\Cypress\PSoC Creator\3.3\PSoC Creator\bin/sjplacer.exe --proj-name dcsd --netlist-vh2 dcsd_p.vh2 --arch-file C:\Program Files (x86)\Cypress\PSoC Creator\3.3\PSoC Creator\dev/arch/p4_udb2x2a.ark --rrg-file C:\Program Files (x86)\Cypress\PSoC Creator\3.3\PSoC Creator\dev/psoc4/psoc4a/route_arch-rrg.cydata --irq-file C:\Program Files (x86)\Cypress\PSoC Creator\3.3\PSoC Creator\dev/psoc4/psoc4a/irqconn.cydata --dsi-conn-file C:\Program Files (x86)\Cypress\PSoC Creator\3.3\PSoC Creator\dev/psoc4/psoc4a/dsiconn.cydata --pins-file pins_28-SSOP.xml --lib-file dcsd_p.lib --sdc-file dcsd.sdc --io-pcf dcsd.pci --outdir .

		Softjin Techologies Placer, Version 1.1

Build Date : Apr 25 2016	12:53:53

D2004: Option and Settings Summary
=============================================================
Netlist vh2 file          - dcsd_p.vh2
Architecture file         - C:\Program Files (x86)\Cypress\PSoC Creator\3.3\PSoC Creator\dev/arch/p4_udb2x2a.ark
Package                   - 
Defparam file             - 
SDC file                  - dcsd.sdc
Output directory          - .
Timing library            - dcsd_p.lib
IO Placement file         - dcsd.pci

D2050: Starting reading inputs for placer
=============================================================
D2065: Reading netlist file : "dcsd_p.vh2"
D2065: Reading arch file : "C:\Program Files (x86)\Cypress\PSoC Creator\3.3\PSoC Creator\dev/arch/p4_udb2x2a.ark"
D2051: Reading of inputs for placer completed successfully

D2053: Starting placement of the design
=============================================================

Phase 2
Phase 3

Design Statistics after Packing
    Number of Combinational MCs 	:	0
    Number of Sequential MCs    	:	6
    Number of DPs               	:	0
    Number of Controls          	:	1
    Number of Status            	:	2
    Number of SyncCells         	:	0
    Number of count7cells       	:	0

Device Utilization Summary after Packing
    Macrocells                  :	6/32
    UDBS                        :	2/4
    IOs                         :	17/36


D2088: Phase 3, elapsed time : 0.0 (sec)

Phase 4
D2088: Phase 4, elapsed time : 0.0 (sec)

Phase 6

######################################################################
Placement Timing Summary

The timing summary is based on estimated routing delays after
placement. For final timing report, please carry out the timing
analysis after routing.
======================================================================

######################################################################
                     Clock Summary 
======================================================================
Number of clocks: 15
Clock: ADC_intClock         | Frequency: N/A       | Target:   4.8 MHz
Clock: ADC_intClock(FFB)    | Frequency: N/A       | Target:   4.8 MHz
Clock: CyHFCLK              | Frequency: 207.3 MHz | Target:  48.0 MHz
Clock: CyILO                | Frequency: N/A       | Target:   0.0 MHz
Clock: CyIMO                | Frequency: N/A       | Target:  48.0 MHz
Clock: CyLFCLK              | Frequency: N/A       | Target:   0.0 MHz
Clock: CyRouted1            | Frequency: N/A       | Target:  48.0 MHz
Clock: CySYSCLK             | Frequency: N/A       | Target:  48.0 MHz
Clock: Cyclk12              | Frequency: N/A       | Target:  12.0 MHz
Clock: Cyclk12(FFB)         | Frequency: N/A       | Target:  12.0 MHz
Clock: UART_SCBCLK          | Frequency: N/A       | Target:   1.4 MHz
Clock: UART_SCBCLK(FFB)     | Frequency: N/A       | Target:   1.4 MHz
Clock: pwmClk               | Frequency: N/A       | Target:  48.0 MHz
Clock: pwmClk(FFB)          | Frequency: N/A       | Target:  48.0 MHz
Clock: qdecClk              | Frequency: 123.4 MHz | Target:   0.9 MHz

======================================================================
                     End of Clock Summary
######################################################################

D2088: Phase 6, elapsed time : 0.0 (sec)

Phase 7
######################################################################
                     Clock Summary 
======================================================================
Number of clocks: 15
Clock: ADC_intClock         | Frequency: N/A       | Target:   4.8 MHz
Clock: ADC_intClock(FFB)    | Frequency: N/A       | Target:   4.8 MHz
Clock: CyHFCLK              | Frequency:  10.9 MHz | Target:  48.0 MHz
Clock: CyILO                | Frequency: N/A       | Target:   0.0 MHz
Clock: CyIMO                | Frequency: N/A       | Target:  48.0 MHz
Clock: CyLFCLK              | Frequency: N/A       | Target:   0.0 MHz
Clock: CyRouted1            | Frequency: N/A       | Target:  48.0 MHz
Clock: CySYSCLK             | Frequency: N/A       | Target:  48.0 MHz
Clock: Cyclk12              | Frequency: N/A       | Target:  12.0 MHz
Clock: Cyclk12(FFB)         | Frequency: N/A       | Target:  12.0 MHz
Clock: UART_SCBCLK          | Frequency: N/A       | Target:   1.4 MHz
Clock: UART_SCBCLK(FFB)     | Frequency: N/A       | Target:   1.4 MHz
Clock: pwmClk               | Frequency: N/A       | Target:  48.0 MHz
Clock: pwmClk(FFB)          | Frequency: N/A       | Target:  48.0 MHz
Clock: qdecClk              | Frequency:  10.9 MHz | Target:   0.9 MHz

======================================================================
                     End of Clock Summary
######################################################################
D2088: Phase 7, elapsed time : 0.0 (sec)

Final Design Statistics
    Number of Combinational MCs 	:	0
    Number of Sequential MCs    	:	6
    Number of DPs               	:	0
    Number of Controls          	:	1
    Number of Status            	:	2
    Number of SyncCells         	:	0
    Number of count7cells       	:	0
    Number of IOs       	:	17

Device Utilization Summary
    Macrocells                  :	6/32
    IOs                         :	17/36



######################################################################
Placement Timing Summary

The timing summary is based on estimated routing delays after
placement. For final timing report, please carry out the timing
analysis after routing.
======================================================================


######################################################################
                     Clock Summary 
======================================================================
Number of clocks: 15
Clock: ADC_intClock         | Frequency: N/A       | Target:   4.8 MHz
Clock: ADC_intClock(FFB)    | Frequency: N/A       | Target:   4.8 MHz
Clock: CyHFCLK              | Frequency:  10.9 MHz | Target:  48.0 MHz
Clock: CyILO                | Frequency: N/A       | Target:   0.0 MHz
Clock: CyIMO                | Frequency: N/A       | Target:  48.0 MHz
Clock: CyLFCLK              | Frequency: N/A       | Target:   0.0 MHz
Clock: CyRouted1            | Frequency: N/A       | Target:  48.0 MHz
Clock: CySYSCLK             | Frequency: N/A       | Target:  48.0 MHz
Clock: Cyclk12              | Frequency: N/A       | Target:  12.0 MHz
Clock: Cyclk12(FFB)         | Frequency: N/A       | Target:  12.0 MHz
Clock: UART_SCBCLK          | Frequency: N/A       | Target:   1.4 MHz
Clock: UART_SCBCLK(FFB)     | Frequency: N/A       | Target:   1.4 MHz
Clock: pwmClk               | Frequency: N/A       | Target:  48.0 MHz
Clock: pwmClk(FFB)          | Frequency: N/A       | Target:  48.0 MHz
Clock: qdecClk              | Frequency:  10.9 MHz | Target:   0.9 MHz

======================================================================
                     End of Clock Summary
######################################################################

Phase 8
D2088: Phase 8, elapsed time : 0.0 (sec)

D2054: Placement of the design completed successfully

I2076: Total run-time: 0.2 sec.

